{
  "schema_version":"1.0.0-draft",
  "programme_id":"SU-REGULATION-OPENFDA-PMA-v0.1",
  "status":"NONCANONICAL_PROGRAMME_CONTROL",
  "source_universe_id":"SU-REGULATION",
  "source_system":"OPENFDA_DEVICE_PMA",
  "as_of":"2026-09-01",
  "provider_contract":{"provider":"U.S. FDA openFDA Device PMA API","endpoint":"https://api.fda.gov/device/pma.json","method":"GET","response_media_type":"application/json","source_dataset":"Premarket Approval (PMA) decisions","time_period_start":"1976","provider_update_frequency":"MONTHLY","reported_denominator_path":"meta.results.total","skip_path":"meta.results.skip","limit_path":"meta.results.limit","results_path":"results","application_lineage_field":"pma_number","supplement_record_field":"supplement_number","max_records_per_request":1000,"max_skip":25000,"max_direct_result_count":26000,"provider_supports_search_after":true,"provider_supports_bulk_downloads":true,"configuration_performs_http":false},
  "workbench_dependency":{"minimum_package_line":"0.3.0.dev0","required_capability":"project_openfda_pma_pages","integration_state":"NOT_IMPLEMENTED"},
  "identity_policy":{"record_identity":"PMA_NUMBER_PLUS_SUPPLEMENT_NUMBER","original_application_sentinel":"ORIGINAL","admitted_pma_prefixes":["P","BP","D"],"h_prefix_hde_out_of_scope_for_v0_1":true,"n_prefix_legacy_nda_out_of_scope_for_v0_1":true,"same_pma_number_different_supplement_auto_merge":false,"trade_name_auto_system_merge":false,"applicant_auto_entity_merge":false,"product_code_auto_system_merge":false,"openfda_harmonized_fields_auto_identity_merge":false,"record_content_change_is_successor_observation_not_new_record_identity":true,"conflicting_same_composite_record_identity_policy":"FAIL_CLOSED"},
  "decision_semantics_policy":{"exact_code_map":{"APPR":"APPROVAL_RECORDED","WTDR":"WITHDRAWAL_RECORDED","DENY":"DENIAL_RECORDED","LE30":"THIRTY_DAY_NOTICE_ACCEPTANCE_RECORDED","APRL":"RECLASSIFICATION_AFTER_APPROVAL_RECORDED","APWD":"WITHDRAWAL_AFTER_APPROVAL_RECORDED","GT30":"NO_DECISION_WITHIN_30_DAYS_RECORDED","APCV":"CONVERSION_AFTER_APPROVAL_RECORDED"},"unknown_or_missing_code_state":"UNRESOLVED_DECISION_CODE","approval_state_requires_exact_appr_code":true,"supplement_approval_does_not_rewrite_original_application_record":true,"record_presence_does_not_imply_approval":true},
  "inclusion_policy":{"candidate_scope":"DECLARED_OPENFDA_PMA_SEARCH_MATCH_WITH_P_BP_D_PREFIX","automatic_source_admission":false,"automatic_device_or_system_entity_creation":false,"automatic_applicant_entity_creation":false,"automatic_original_supplement_lineage_relationship_creation":false,"automatic_current_commercial_configuration_claim_creation":false,"automatic_global_authorization_claim_creation":false,"automatic_system_conformance_claim_creation":false,"automatic_assessment_mutation":false,"automatic_reopening_decision":false,"automatic_monitor_creation":false,"human_relevance_review_required":true},
  "paging_policy":{"execution_mode_v0_1":"SKIP_LIMIT_BOUNDED","page_limit":1000,"initial_skip":0,"max_skip":25000,"max_direct_result_count":26000,"over_limit_policy":"SEARCH_AFTER_OR_DECISION_DATE_PARTITION_REQUIRED_BEFORE_MATERIALIZATION","preferred_partition_field":"decision_date","silent_truncation_allowed":false,"partial_over_limit_candidate_emission_allowed":false,"search_after_not_yet_authorized_by_v0_1_projector":true,"partition_provenance_required":true},
  "query_streams":[
    {"query_id":"DISCOVERY-OPENFDA-PMA-BCI-001","search":"generic_name:\"brain+computer+interface\"+OR+generic_name:\"brain+machine+interface\"+OR+generic_name:\"neural+interface\"+OR+trade_name:\"neural+interface\"","cadence":"MONTHLY","status":"ACTIVE","scope_tiers":["A"],"purpose":"PMA application/supplement decision discovery for explicit BCI/neural-interface terminology.","completeness_claim":false},
    {"query_id":"DISCOVERY-OPENFDA-PMA-DBS-NEUROSTIM-001","search":"generic_name:\"deep+brain+stimulator\"+OR+generic_name:\"deep+brain+stimulation\"+OR+generic_name:neurostimulator+OR+trade_name:neurostimulator","cadence":"MONTHLY","status":"ACTIVE","scope_tiers":["A","B"],"purpose":"PMA discovery for DBS and neurostimulator application/supplement decisions.","completeness_claim":false},
    {"query_id":"DISCOVERY-OPENFDA-PMA-NEUROPROSTHESIS-001","search":"generic_name:neuroprosthesis+OR+generic_name:\"neural+prosthesis\"+OR+generic_name:\"brain+prosthesis\"","cadence":"MONTHLY","status":"ACTIVE","scope_tiers":["A","B"],"purpose":"PMA discovery for neuroprosthetic application/supplement decisions.","completeness_claim":false},
    {"query_id":"DISCOVERY-OPENFDA-PMA-VISUAL-NEUROPROSTHESIS-001","search":"generic_name:\"retinal+prosthesis\"+OR+generic_name:\"retinal+implant\"+OR+generic_name:\"visual+prosthesis\"+OR+trade_name:\"retinal+implant\"","cadence":"MONTHLY","status":"ACTIVE","scope_tiers":["A","B"],"purpose":"PMA discovery for retinal/visual prosthetic application/supplement decisions.","completeness_claim":false},
    {"query_id":"DISCOVERY-OPENFDA-PMA-NEURAL-RECORDING-001","search":"generic_name:\"intracortical+electrode\"+OR+generic_name:\"brain+electrode\"+OR+generic_name:electrocorticography","cadence":"MONTHLY","status":"ACTIVE","scope_tiers":["A","B"],"purpose":"PMA discovery for invasive neural-recording application/supplement decisions.","completeness_claim":false}
  ],
  "candidate_projection":{"required_fields":["pma_number","supplement_number","record_identity","record_role","trade_name","generic_name","applicant","date_received","decision_date","decision_code","decision_semantics","product_code","supplement_type","supplement_reason","ao_statement","expedited_review_flag","query_memberships","normalized_record_sha256"],"address_or_contact_fields_in_discovery_layer":false,"raw_api_pages_emitted_to_s2":false,"hde_records_emitted_as_pma_candidates":false,"legacy_nda_records_emitted_as_pma_candidates":false,"decision_semantics_derived_only_from_exact_decision_code":true},
  "coverage_contract":{"required_metrics_per_leaf_query":["supplied_page_count","returned_record_count","unique_composite_record_count","reported_total_count","reported_total_count_state","skip_sequence_valid","skip_coverage_state","over_26000_limit","search_after_or_partition_required","out_of_scope_hde_count","out_of_scope_legacy_nda_count","known_controlled_duplicate_count","new_candidate_count","duplicate_representation_count","unresolved_pma_number_count"],"mechanical_completion_requires":{"reported_total_count_state":"CONSISTENT","skip_sequence_valid":true,"skip_coverage_state":"MATCH","over_26000_limit":false,"search_after_or_partition_required":false},"pma_database_completeness_claim":false,"global_neuroai_pma_coverage_claim":false,"query_recall_claim":false,"record_presence_is_approval_claim":false,"supplement_approval_is_original_application_approval_claim":false,"approval_is_global_authorization_claim":false,"approval_is_all_configuration_conformance_claim":false},
  "human_review_contract":{"required_dispositions":["ACCEPT","REJECT","DEFER","EXCLUDE"],"review_questions":["Is this exact original PMA or supplement record materially relevant to a represented NeuroAI/neurotechnology system?","Is the composite pma_number + supplement_number identity exact and is the prefix in PMA v0.1 scope?","What exact FDA decision code/state is recorded?","If this is a supplement, what change does the supplement type/reason/approval-order statement actually support?","Does the record resolve the exact assessed or commercial configuration, or only a broader PMA lineage?","Does the decision create a candidate assessment reopening trigger, and what human authority must decide it?","What global authorization, present-configuration, effectiveness or conformance inference remains prohibited?"],"automatic_acceptance":false,"record_presence_is_approval_evidence":false,"supplement_record_automatically_changes_original_approval_scope":false,"approval_record_is_global_authorization":false,"approval_record_establishes_exact_current_commercial_configuration":false,"approval_record_is_all_configuration_conformance_evidence":false,"approval_record_automatically_reopens_assessment":false},
  "network_policy":{"live_execution":"OPT_IN_ONLY","requires_workbench_network_gate":true,"configuration_performs_http":false,"hosted_success_claim_allowed_without_runner_steps":false},
  "boundary":"This programme discovers FDA PMA application and supplement decision records. Composite pma_number + supplement_number preserves record identity and prevents supplements from overwriting the original application. Exact decision semantics come only from FDA decision codes. APPR records provide scoped FDA approval evidence for the corresponding application/supplement, but do not by themselves establish global authorization, the exact current commercial configuration, all-configuration conformance, automatic assessment reopening, or UNESCO/institutional endorsement. H-prefixed HDE and N-prefixed legacy NDA records are out of v0.1 scope."
}
